{
  "version": 3,
  "targets": {
    "net8.0": {
      "BenchmarkDotNet/0.13.2": {
        "type": "package"
      },
      "Microsoft.Extensions.Logging.Abstractions/8.0.2": {
        "type": "package"
      },
      "Microsoft.Identity.Client.Extensions.Msal/4.83.1": {
        "type": "package"
      },
      "Microsoft.Identity.Client/4.83.1": {
        "type": "package"
      },
      "Microsoft.Identity.Client.Broker/4.83.1": {
        "type": "package",
        "dependencies": {
          "Microsoft.Identity.Client": "4.83.1"
        }
      },
      "Microsoft.Identity.Client.NativeInterop/0.20.3": {
        "type": "package"
      },
      "Microsoft.IdentityModel.JsonWebTokens/7.5.0": {
        "type": "package"
      },
      "MSALWrapper/1.0.0": {
        "type": "project",
        "dependencies": {
          "Microsoft.Extensions.Logging.Abstractions": "8.0.2",
          "Microsoft.Identity.Client.Extensions.Msal": "4.83.1",
          "Microsoft.Identity.Client": "4.83.1",
          "Microsoft.Identity.Client.Broker": "4.83.1",
          "Microsoft.Identity.Client.NativeInterop": "0.20.3",
          "Microsoft.IdentityModel.JsonWebTokens": "7.5.0"
        }
      }
    },
    "net8.0/win-x64": {
      "BenchmarkDotNet/0.13.2": {
        "type": "package",
        "dependencies": {
          "Synthetic.Runtime.Windows": "1.0.0"
        }
      },
      "Microsoft.Extensions.Logging.Abstractions/8.0.2": {
        "type": "package"
      },
      "Microsoft.Identity.Client.Extensions.Msal/4.83.1": {
        "type": "package"
      },
      "Microsoft.Identity.Client/4.83.1": {
        "type": "package"
      },
      "Microsoft.Identity.Client.Broker/4.83.1": {
        "type": "package",
        "dependencies": {
          "Microsoft.Identity.Client": "4.83.1"
        }
      },
      "Microsoft.Identity.Client.NativeInterop/0.20.3": {
        "type": "package"
      },
      "Microsoft.IdentityModel.JsonWebTokens/7.5.0": {
        "type": "package"
      },
      "MSALWrapper/1.0.0": {
        "type": "project",
        "dependencies": {
          "Microsoft.Extensions.Logging.Abstractions": "8.0.2",
          "Microsoft.Identity.Client.Extensions.Msal": "4.83.1",
          "Microsoft.Identity.Client": "4.83.1",
          "Microsoft.Identity.Client.Broker": "4.83.1",
          "Microsoft.Identity.Client.NativeInterop": "0.20.3",
          "Microsoft.IdentityModel.JsonWebTokens": "7.5.0"
        }
      },
      "Synthetic.Runtime.Windows/1.0.0": {
        "type": "package"
      }
    }
  },
  "libraries": {
    "BenchmarkDotNet/0.13.2": {
      "type": "package"
    },
    "Microsoft.Extensions.Logging.Abstractions/8.0.2": {
      "type": "package"
    },
    "Microsoft.Identity.Client.Extensions.Msal/4.83.1": {
      "type": "package"
    },
    "Microsoft.Identity.Client/4.83.1": {
      "type": "package"
    },
    "Microsoft.Identity.Client.Broker/4.83.1": {
      "type": "package"
    },
    "Microsoft.Identity.Client.NativeInterop/0.20.3": {
      "type": "package"
    },
    "Microsoft.IdentityModel.JsonWebTokens/7.5.0": {
      "type": "package"
    },
    "MSALWrapper/1.0.0": {
      "type": "project",
      "msbuildProject": "../MSALWrapper/MSALWrapper.csproj"
    },
    "Synthetic.Runtime.Windows/1.0.0": {
      "type": "package"
    }
  },
  "packageFolders": {
    "C:\\fixture\\packages\\source-faithful\\": {}
  },
  "project": {
    "restore": {
      "configFilePaths": [
        "C:\\fixture\\checkout\\nuget.config"
      ],
      "packagesPath": "C:\\fixture\\packages\\source-faithful",
      "projectPath": "C:\\fixture\\checkout\\src\\MSALWrapper.Benchmark\\MSALWrapper.Benchmark.csproj",
      "sources": {
        "https://pkgs.dev.azure.com/office/_packaging/Office/nuget/v3/index.json": {}
      },
      "frameworks": {
        "net8.0": {
          "projectReferences": {
            "C:\\fixture\\checkout\\src\\MSALWrapper\\MSALWrapper.csproj": {
              "projectPath": "C:\\fixture\\checkout\\src\\MSALWrapper\\MSALWrapper.csproj"
            }
          }
        }
      }
    },
    "frameworks": {
      "net8.0": {
        "dependencies": {
          "BenchmarkDotNet": {
            "target": "Package",
            "version": "[0.13.2, )"
          },
          "Microsoft.Identity.Client.Broker": {
            "target": "Package",
            "version": "[4.83.1, )"
          },
          "MSALWrapper": {
            "target": "Project",
            "version": "[1.0.0, )"
          }
        }
      }
    }
  }
}
