{
  "version": 3,
  "targets": {
    "net8.0": {
      "Microsoft.Extensions.Logging.Abstractions/8.0.2": {
        "type": "package",
        "dependencies": {
          "System.Diagnostics.DiagnosticSource": "[8.0.0, )"
        }
      },
      "NLog.Extensions.Logging/1.6.3": {
        "type": "package",
        "dependencies": {
          "Microsoft.Extensions.Logging.Abstractions": "1.1.2"
        }
      },
      "System.Diagnostics.DiagnosticSource/8.0.1": {
        "type": "package"
      }
    },
    "net8.0/linux-x64": {
      "Microsoft.Extensions.Logging.Abstractions/8.0.2": {
        "type": "package",
        "dependencies": {
          "System.Diagnostics.DiagnosticSource": "[8.0.0, )"
        }
      },
      "NLog.Extensions.Logging/1.6.3": {
        "type": "package",
        "dependencies": {
          "Microsoft.Extensions.Logging.Abstractions": "1.1.2"
        }
      },
      "System.Diagnostics.DiagnosticSource/8.0.1": {
        "type": "package",
        "dependencies": {
          "Synthetic.Runtime.Linux": "1.0.0"
        }
      },
      "Synthetic.Runtime.Linux/1.0.0": {
        "type": "package"
      }
    }
  },
  "libraries": {
    "Microsoft.Extensions.Logging.Abstractions/8.0.2": {
      "type": "package"
    },
    "NLog.Extensions.Logging/1.6.3": {
      "type": "package"
    },
    "System.Diagnostics.DiagnosticSource/8.0.1": {
      "type": "package"
    },
    "Synthetic.Runtime.Linux/1.0.0": {
      "type": "package"
    }
  },
  "packageFolders": {
    "/fixture/packages/source-faithful/": {}
  },
  "project": {
    "restore": {
      "configFilePaths": [
        "/fixture/checkout/nuget.config"
      ],
      "packagesPath": "/fixture/packages/source-faithful",
      "projectPath": "/fixture/checkout/src/TestHelper/TestHelper.csproj",
      "sources": {
        "https://pkgs.dev.azure.com/office/_packaging/Office/nuget/v3/index.json": {}
      },
      "frameworks": {
        "net8.0": {
          "projectReferences": {}
        }
      }
    },
    "frameworks": {
      "net8.0": {
        "dependencies": {
          "Microsoft.Extensions.Logging.Abstractions": {
            "target": "Package",
            "version": "[8.0.2, )"
          },
          "NLog.Extensions.Logging": {
            "target": "Package",
            "version": "[1.6.3, )"
          }
        }
      }
    }
  }
}
